{
  "version": "1.0",
  "artifact": "HANDOFF_JSON",
  "from_agent": "ju_chief_estimate",
  "to_agent": "ju_orchestrator",
  "domain": "estimate",
  "site_id": null,
  "customer_id": null,
  "stage": "consultation",
  "summary": "양주 35평 A/B 비교 완료 — 외장 세라믹 vs 섬유시멘트",
  "payload": {
    "estimate_summary": "35평 단층, 예산 범위 제시, A안 세라믹 / B안 섬유시멘트",
    "options": {
      "plan_a": {"exterior": "세라믹", "roof": "스탠딩심 메탈"},
      "plan_b": {"exterior": "섬유시멘트", "roof": "스탠딩심 메탈"},
      "diff_summary": "A안이 유지보수·자정성에 유리, B안이 초기 비용 부담 완화"
    },
    "customer_talking_points": [
      "단열·기밀이 추위를 좌우합니다",
      "공정은 골조→지붕→외장 순으로 투명하게 공유합니다",
      "단가가 아니라 범위와 조건으로 설명드립니다"
    ],
    "risks": ["부지 경사에 따른 기초 보강 가능성"],
    "asks_from_peers": ["현장 실측 일정 확정"]
  },
  "cross_domain_flags": {
    "affects_field": false,
    "affects_marketing": false,
    "notes": ""
  },
  "priority": "normal",
  "created_at": "2026-01-01T00:00:00+09:00"
}
